{
  "regionCode": "cn",
  "schemaVersion": "1.0.0",
  "snapshots": [
    {
      "items": [
        {
          "catalogKey": "bytedance/doubao-seed-2-1-pro-260628",
          "modelId": "doubao-seed-2-1-pro-260628",
          "pricingText": "CNY 6.00 / 1M input; CNY 1.20 / 1M cache read; CNY 30.00 / 1M output",
          "rankNo": 8
        },
        {
          "catalogKey": "bytedance/doubao-seed-2-1-turbo-260628",
          "modelId": "doubao-seed-2-1-turbo-260628",
          "pricingText": "CNY 3.00 / 1M input; CNY 0.60 / 1M cache read; CNY 15.00 / 1M output",
          "rankNo": 11
        },
        {
          "catalogKey": "bytedance/doubao-seed-2-0-pro-260215",
          "modelId": "doubao-seed-2-0-pro-260215",
          "pricingText": "CNY 3.20 / 1M input; CNY 16.00 / 1M output",
          "rankNo": 16
        }
      ],
      "rankScope": "china-mainland-default",
      "snapshotDate": "2026-06-24",
      "snapshotPeriod": "daily"
    }
  ],
  "vendorCode": "bytedance"
}
