{
  "regionCode": "global",
  "schemaVersion": "1.0.0",
  "snapshots": [
    {
      "items": [
        {
          "catalogKey": "minimax/hailuo-2.3",
          "modelId": "hailuo-2.3",
          "pricingText": "USD 0.045 / output second (768p)",
          "rankNo": 16
        },
        {
          "catalogKey": "minimax/hailuo-02",
          "modelId": "hailuo-02",
          "pricingText": "USD 0.045 / output second (768p)",
          "rankNo": 17
        },
        {
          "catalogKey": "minimax/music-2.6",
          "modelId": "music-2.6",
          "pricingText": "$0.15 / song (up to 5 min)",
          "rankNo": 18
        },
        {
          "catalogKey": "minimax/music-cover",
          "modelId": "music-cover",
          "pricingText": "$0.15 / cover generation",
          "rankNo": 19
        },
        {
          "catalogKey": "minimax/hailuo-2.3-fast",
          "modelId": "hailuo-2.3-fast",
          "pricingText": "USD 0.031 / output second (768p)",
          "rankNo": 23
        },
        {
          "catalogKey": "minimax/speech-2.8-hd",
          "modelId": "speech-2.8-hd",
          "pricingText": "$0.10 / 1K characters",
          "rankNo": 24
        },
        {
          "catalogKey": "minimax/speech-2.8-turbo",
          "modelId": "speech-2.8-turbo",
          "pricingText": "$0.06 / 1K characters",
          "rankNo": 25
        }
      ],
      "rankScope": "commercial-default",
      "snapshotDate": "2026-07-02",
      "snapshotPeriod": "daily"
    }
  ],
  "vendorCode": "minimax"
}
