{
  "regionCode": "cn",
  "schemaVersion": "1.0.0",
  "snapshots": [
    {
      "items": [
        {
          "catalogKey": "meituan/longcat-1.0",
          "modelId": "longcat-1.0",
          "pricingText": "CNY 4.50 / 1M input; CNY 1.00 / 1M cache read; CNY 16.00 / 1M output",
          "rankNo": 19
        }
      ],
      "rankScope": "china-mainland-default",
      "snapshotDate": "2026-07-02",
      "snapshotPeriod": "daily"
    }
  ],
  "vendorCode": "meituan"
}
