{
  "regionCode": "cn",
  "schemaVersion": "1.0.0",
  "snapshots": [
    {
      "items": [
        {
          "catalogKey": "alibaba/qwen3.8-max-preview",
          "modelId": "qwen3.8-max-preview",
          "pricingText": "CNY 8.00 / 1M input; CNY 32.00 / 1M output; CNY 14.00 / CNY 60.00 above 128K",
          "rankNo": 1
        },
        {
          "catalogKey": "alibaba/qwen3.7-max",
          "modelId": "qwen3.7-max",
          "pricingText": "CNY 12.00 / 1M input; CNY 36.00 / 1M output",
          "rankNo": 2
        },
        {
          "catalogKey": "alibaba/qwen3.6-max-preview",
          "modelId": "qwen3.6-max-preview",
          "pricingText": "CNY 9.00 / 1M input; CNY 54.00 / 1M output; CNY 15.00 / CNY 90.00 above 128K",
          "rankNo": 12
        }
      ],
      "rankScope": "commercial-default",
      "snapshotDate": "2026-07-19",
      "snapshotPeriod": "daily"
    }
  ],
  "vendorCode": "alibaba"
}
