{
  "regionCode": "global",
  "schemaVersion": "1.0.0",
  "snapshots": [
    {
      "items": [
        {
          "catalogKey": "anthropic/claude-opus-5",
          "modelId": "claude-opus-5",
          "pricingText": "$5.00 / 1M input; $25.00 / 1M output; $0.50 / 1M cache read",
          "rankNo": 1
        },
        {
          "catalogKey": "anthropic/claude-fable-5",
          "modelId": "claude-fable-5",
          "pricingText": "$10.00 / 1M input; $50.00 / 1M output",
          "rankNo": 2
        },
        {
          "catalogKey": "anthropic/claude-opus-4-8",
          "modelId": "claude-opus-4-8",
          "pricingText": "$5.00 / 1M input; $25.00 / 1M output",
          "rankNo": 3
        },
        {
          "catalogKey": "anthropic/claude-opus-4-7",
          "modelId": "claude-opus-4-7",
          "pricingText": "$5.00 / 1M input; $25.00 / 1M output",
          "rankNo": 4
        },
        {
          "catalogKey": "anthropic/claude-sonnet-5",
          "modelId": "claude-sonnet-5",
          "pricingText": "$3.00 / 1M input; $15.00 / 1M output (introductory $2 / $10 through 2026-08-31)",
          "rankNo": 5
        },
        {
          "catalogKey": "anthropic/claude-sonnet-4-6",
          "modelId": "claude-sonnet-4-6",
          "pricingText": "$3.00 / 1M input; $15.00 / 1M output; $6.00 / $22.50 above 200K",
          "rankNo": 6
        },
        {
          "catalogKey": "anthropic/claude-haiku-4-5",
          "modelId": "claude-haiku-4-5",
          "pricingText": "$1.00 / 1M input; $5.00 / 1M output",
          "rankNo": 7
        }
      ],
      "rankScope": "commercial-default",
      "snapshotDate": "2026-07-24",
      "snapshotPeriod": "daily"
    }
  ],
  "vendorCode": "anthropic"
}
