{
  "regionCode": "global",
  "schemaVersion": "1.0.0",
  "snapshots": [
    {
      "items": [
        {
          "catalogKey": "google/gemini-3.5-flash",
          "modelId": "gemini-3.5-flash",
          "pricingText": "$1.50 / 1M input; $9.00 / 1M output",
          "rankNo": 1
        },
        {
          "catalogKey": "google/gemini-3.1-pro-preview",
          "modelId": "gemini-3.1-pro-preview",
          "pricingText": "$2.00 / 1M input; $12.00 / 1M output",
          "rankNo": 2
        },
        {
          "catalogKey": "google/gemini-3-flash-preview",
          "modelId": "gemini-3-flash-preview",
          "pricingText": "$0.50 / 1M input; $3.00 / 1M output",
          "rankNo": 3
        },
        {
          "catalogKey": "google/gemini-3.1-flash-lite",
          "modelId": "gemini-3.1-flash-lite",
          "pricingText": "$0.10 / 1M input; $0.40 / 1M output",
          "rankNo": 4
        },
        {
          "catalogKey": "google/gemini-3.1-flash-lite-preview",
          "modelId": "gemini-3.1-flash-lite-preview",
          "pricingText": "$0.10 / 1M input; $0.40 / 1M output",
          "rankNo": 5
        },
        {
          "catalogKey": "google/gemini-3.1-flash-live-preview",
          "modelId": "gemini-3.1-flash-live-preview",
          "pricingText": "$0.50 / 1M text input; $3.00 / 1M audio/video input; $12.00 / 1M audio output",
          "rankNo": 6
        },
        {
          "catalogKey": "google/gemini-3.1-flash-image-preview",
          "modelId": "gemini-3.1-flash-image-preview",
          "pricingText": "$0.30 / 1M text input; $30.00 / 1M image output",
          "rankNo": 7
        },
        {
          "catalogKey": "google/gemini-3.1-flash-tts-preview",
          "modelId": "gemini-3.1-flash-tts-preview",
          "pricingText": "$0.50 / 1M text input; $10.00 / 1M audio output",
          "rankNo": 8
        },
        {
          "catalogKey": "google/veo-3.1-generate-preview",
          "modelId": "veo-3.1-generate-preview",
          "pricingText": "$0.40 / output second",
          "rankNo": 9
        },
        {
          "catalogKey": "google/veo-3.1-fast-generate-preview",
          "modelId": "veo-3.1-fast-generate-preview",
          "pricingText": "$0.15 / output second",
          "rankNo": 10
        },
        {
          "catalogKey": "google/veo-3.1-lite-generate-preview",
          "modelId": "veo-3.1-lite-generate-preview",
          "pricingText": "$0.10 / output second",
          "rankNo": 11
        },
        {
          "catalogKey": "google/imagen-4.0-generate-001",
          "modelId": "imagen-4.0-generate-001",
          "pricingText": "$0.04 / image result",
          "rankNo": 12
        }
      ],
      "rankScope": "commercial-default",
      "snapshotDate": "2026-05-07",
      "snapshotPeriod": "daily"
    }
  ],
  "vendorCode": "google"
}
